{
  "id": "strategy-agent-001",
  "targetId": "target-agent-engineer",
  "objective": "突出 Agent workflow、长任务、RAG 与平台工程能力",
  "requirements": [
    {
      "id": "req-001",
      "category": "architecture",
      "statement": "具备多 Agent 工作流设计与落地经验",
      "importance": "MUST",
      "keywords": ["Multi-Agent", "LangGraph"],
      "evidenceNeeded": "DIRECT 或 OWNER 的工作流实现 Claim",
      "sourceText": "负责多 Agent 工作流设计与落地"
    }
  ],
  "requirementCoverage": [
    {
      "requirementId": "req-001",
      "status": "covered",
      "claimIds": ["claim-a2a-workflow"],
      "notes": "LangGraph 1 Supervisor + 6 Specialist Agents"
    }
  ],
  "selectedExperienceIds": ["exp-a2a-platform"],
  "selectedClaimIds": ["claim-a2a-workflow", "claim-a2a-outbox"],
  "claimScores": [
    {
      "claimId": "claim-a2a-workflow",
      "score": 95,
      "matchedRequirementIds": ["req-001"],
      "reason": "直接覆盖核心 requirement，且为实际实现"
    }
  ],
  "excludedClaims": [],
  "sectionPlan": [
    {
      "section": "projects",
      "priority": 1,
      "budget": "3 bullets",
      "experienceIds": ["exp-a2a-platform"]
    }
  ],
  "emphasis": ["Multi-Agent Workflow", "Long-running Task", "RAG"],
  "coverageGaps": [],
  "riskNotes": []
}
